{
  "collections": {
    "adrs": [
      {
        "assertions": [
          {
            "description": "A régua nunca existe no consumidor: webqa/, checks/ e a lista curada.",
            "id": "ADR-001-A1",
            "kind": "path_absent",
            "paths": [
              "webqa",
              "checks",
              "data/caminhos-sensiveis.yaml"
            ],
            "risk": "RISK-WEBQA-001",
            "severity": "critical"
          },
          {
            "description": "O passo de CI que recusa régua copiada continua existindo.",
            "files": [
              ".github/workflows/qa.yml"
            ],
            "id": "ADR-001-A2",
            "kind": "file_matches",
            "pattern": "name:\\s*Recusar régua copiada",
            "risk": "RISK-WEBQA-001",
            "severity": "critical"
          },
          {
            "description": "O passo ainda enumera os TRÊS alvos — remover um da lista é desligar a trava.",
            "files": [
              ".github/workflows/qa.yml"
            ],
            "id": "ADR-001-A3",
            "kind": "file_matches",
            "pattern": "for alvo in webqa checks data/caminhos-sensiveis\\.yaml",
            "risk": "RISK-WEBQA-001",
            "severity": "critical"
          },
          {
            "description": "O pin é exato: nenhuma faixa de versão para webqa-suite.",
            "files": [
              "requirements-qa.txt"
            ],
            "id": "ADR-001-A4",
            "kind": "file_lacks",
            "mutation": {
              "alvo": "requirements-qa.txt",
              "op": "injetar_texto",
              "texto": "webqa-suite>=1.0.0  # faixa em vez de pin exato"
            },
            "pattern": "^\\s*webqa-suite\\s*[<>~!]=",
            "risk": "RISK-DEP-001",
            "severity": "high"
          }
        ],
        "file": "architecture/adr/ADR-001-webqa-como-padrao-externo.md",
        "id": "ADR-001",
        "related_risks": [
          "RISK-WEBQA-001"
        ],
        "status": "accepted",
        "title": "Consumir a WebQA Suite como padrão externo, nunca copiado"
      },
      {
        "assertions": [
          {
            "description": "Os fiscais estruturais e semânticos existem como código, não como promessa.",
            "id": "ADR-002-A1",
            "kind": "path_present",
            "paths": [
              "ci/validate_metadata.py",
              ".github/workflows/validate-metadata.yml",
              "harness/schemas/harness.schema.json"
            ],
            "risk": "RISK-META-001",
            "severity": "critical"
          },
          {
            "description": "Toda política aponta para seu fiscal — o próprio README diz que entrada sem apontamento é lembrete, não garantia.",
            "exclude": [
              "harness/policies/README.md"
            ],
            "files": [
              "harness/policies/*.md"
            ],
            "id": "ADR-002-A2",
            "kind": "file_matches",
            "match": "all",
            "pattern": "^Fiscalizado por:",
            "risk": "RISK-META-001",
            "severity": "high"
          },
          {
            "description": "Os fiscais de comportamento e o manifesto de etapas existem.",
            "id": "ADR-002-A3",
            "kind": "path_present",
            "paths": [
              "ci/audit_governance.py",
              "ci/audit_lgpd.py",
              "harness/stages.yaml"
            ],
            "risk": "RISK-CONF-001",
            "severity": "high"
          }
        ],
        "file": "architecture/adr/ADR-002-enforcement-nao-em-markdown.md",
        "id": "ADR-002",
        "related_risks": [
          "RISK-META-001"
        ],
        "status": "accepted",
        "title": "Enforcement mora em schema, CI e gates — não em markdown"
      },
      {
        "assertions": [
          {
            "description": "O schema fixa ONDE a versão mora, e não admite restatá-la.",
            "expected": "requirements-qa.txt",
            "file": "harness/schemas/project.schema.json",
            "id": "ADR-003-A1",
            "kind": "schema_lock",
            "pointer": "/properties/quality_standard/properties/version_source/const",
            "risk": "RISK-DEP-001",
            "severity": "high"
          },
          {
            "description": "additionalProperties:false em quality_standard é o que impede acrescentar 'version:'.",
            "expected": false,
            "file": "harness/schemas/project.schema.json",
            "id": "ADR-003-A2",
            "kind": "schema_lock",
            "pointer": "/properties/quality_standard/additionalProperties",
            "risk": "RISK-DEP-001",
            "severity": "high"
          },
          {
            "contains": "sensitive_paths_hash",
            "description": "A procedência continua exigindo o hash da lista curada — é o que revela régua editada.",
            "file": "harness/schemas/provenance.schema.json",
            "id": "ADR-003-A3",
            "kind": "schema_lock",
            "pointer": "/properties/standard/required",
            "risk": "RISK-DEP-001",
            "severity": "high"
          },
          {
            "description": "project.yaml não restata a versão do padrão: nenhum semver de três partes.",
            "files": [
              "project.yaml"
            ],
            "id": "ADR-003-A4",
            "kind": "file_lacks",
            "mutation": {
              "alvo": "project.yaml",
              "op": "injetar_texto",
              "texto": "# versao restatada indevidamente: 1.2.3"
            },
            "pattern": "\\b[0-9]+\\.[0-9]+\\.[0-9]+\\b",
            "risk": "RISK-DEP-001",
            "severity": "high"
          }
        ],
        "file": "architecture/adr/ADR-003-versao-em-fonte-unica.md",
        "id": "ADR-003",
        "related_capabilities": [
          "CAP-PRICING"
        ],
        "related_risks": [
          "RISK-DEP-001"
        ],
        "status": "accepted",
        "title": "Versão do padrão em fonte única e procedência carimbada"
      },
      {
        "assertions": [
          {
            "description": "Risco high/critical continua EXIGINDO aval humano — a trava if/then não foi removida.",
            "expected": true,
            "file": "harness/schemas/change-proposal.schema.json",
            "id": "ADR-004-A1",
            "kind": "schema_lock",
            "pointer": "/allOf/0/then/properties/proposal/properties/human_approval_required/const",
            "risk": "RISK-CHANGE-001",
            "severity": "critical"
          },
          {
            "description": "O gatilho da trava não foi estreitado: continua disparando em high E critical.",
            "expected": [
              "high",
              "critical"
            ],
            "file": "harness/schemas/change-proposal.schema.json",
            "id": "ADR-004-A2",
            "kind": "schema_lock",
            "pointer": "/allOf/0/if/properties/proposal/properties/risk_assessment/properties/level/enum",
            "risk": "RISK-CHANGE-001",
            "severity": "high"
          },
          {
            "description": "change_mode é const pull_request — mudança nunca é aplicada direto.",
            "expected": "pull_request",
            "file": "harness/schemas/change-proposal.schema.json",
            "id": "ADR-004-A3",
            "kind": "schema_lock",
            "pointer": "/properties/proposal/properties/change_mode/const",
            "risk": "RISK-CHANGE-001",
            "severity": "high"
          }
        ],
        "file": "architecture/adr/ADR-004-mudanca-proposta-declarada.md",
        "id": "ADR-004",
        "related_risks": [
          "RISK-CHANGE-001"
        ],
        "status": "accepted",
        "title": "Toda mudança proposta é declarada e validada antes de executada"
      },
      {
        "assertions": [
          {
            "description": "A precificação depende da PORTA — o contrato, não uma implementação.",
            "id": "ADR-005-A1",
            "kind": "import_required",
            "module_glob": "src/project/pricing.py",
            "risk": "RISK-CONF-001",
            "severity": "high",
            "symbols": [
              "project.ports.CatalogoProdutos"
            ]
          },
          {
            "description": "A precificação nunca toca o adaptador concreto — é o que a decisão significa.",
            "id": "ADR-005-A2",
            "kind": "import_forbidden",
            "module_glob": "src/project/pricing.py",
            "risk": "RISK-CONF-001",
            "severity": "high",
            "symbols": [
              "project.ports.CatalogoEmMemoria"
            ]
          },
          {
            "description": "A porta não depende do consumidor: sem ciclo entre domínio e contrato.",
            "id": "ADR-005-A3",
            "kind": "import_forbidden",
            "module_glob": "src/project/ports.py",
            "risk": "RISK-CONF-001",
            "severity": "medium",
            "symbols": [
              "project.pricing"
            ]
          },
          {
            "description": "A porta continua sendo um Protocol, não uma classe concreta rebatizada.",
            "files": [
              "src/project/ports.py"
            ],
            "id": "ADR-005-A4",
            "kind": "file_matches",
            "pattern": "class\\s+CatalogoProdutos\\(Protocol\\)",
            "risk": "RISK-CONF-001",
            "severity": "high"
          },
          {
            "description": "O teste que a seção Fiscal do ADR nomeia existe de fato.",
            "id": "ADR-005-A5",
            "kind": "path_present",
            "paths": [
              "tests/unit/test_pricing.py"
            ],
            "risk": "RISK-CONF-001",
            "severity": "medium"
          }
        ],
        "file": "architecture/adr/ADR-005-catalogo-via-porta.md",
        "id": "ADR-005",